{
  "$schema": "http://json-schema.org/draft-07/schema#",
  "$id": "https://schemas.hl7v2-rs.org/evidence/evidence-bundle/v1",
  "title": "HL7v2 Evidence Bundle Summary",
  "description": "Current machine-readable stdout summary emitted after creating an evidence bundle.",
  "type": "object",
  "additionalProperties": false,
  "required": [
    "bundle_version",
    "output_dir",
    "message_type",
    "validation_valid",
    "validation_issue_count",
    "redaction_phi_removed",
    "artifacts"
  ],
  "properties": {
    "bundle_version": {
      "type": "string"
    },
    "output_dir": {
      "type": "string",
      "description": "Bundle output directory reported by the command."
    },
    "message_type": {
      "type": "string"
    },
    "validation_valid": {
      "type": "boolean"
    },
    "validation_issue_count": {
      "type": "integer",
      "minimum": 0
    },
    "redaction_phi_removed": {
      "type": "boolean"
    },
    "artifacts": {
      "type": "array",
      "items": {
        "type": "string"
      }
    }
  }
}
